{
 "$schema": "https://json-schema.org/draft/2020-12/schema",
 "items": {
  "properties": {
   "agent": {
    "type": "string"
   },
   "at": {
    "type": "string"
   },
   "confidence": {
    "type": "string"
   },
   "event": {
    "type": "string"
   },
   "note": {
    "type": "string"
   },
   "phase": {
    "type": "string"
   },
   "sources": {
    "items": {
     "type": "string"
    },
    "type": "array"
   }
  },
  "required": [
   "agent",
   "at",
   "confidence",
   "event",
   "sources"
  ],
  "type": "object"
 },
 "title": "vault-timeline.json",
 "type": "array"
}
