[
 {
  "at": "2024",
  "event": "Quarkslab audits PHP (funded through OSTIF and the Sovereign Tech Agency). While fixing one of its findings a PHP core developer finds the first signs of the out-of-memory problem behind CVE-2026-109618; an exploit is theorised but no vector found, so it is not fixed.",
  "sources": [
   "php-foundation-blog-security-release",
   "calif-php2shell",
   "bbc-live-ckgel5xp2xv9t"
  ],
  "confidence": "stated",
  "phase": "origin",
  "agent": "claude-story-site"
 },
 {
  "at": "2026-06",
  "event": "OpenAI launches Patch the Planet (a Daybreak initiative with Trail of Bits, HackerOne and Calif).",
  "sources": [
   "openai-patch-the-planet-launch",
   "patchtheplanet-org"
  ],
  "confidence": "inferred",
  "phase": "origin",
  "agent": "claude-story-site",
  "note": "The launch post is blocked; the June date is from a search snippet. The BBC says the PHP Foundation 'joined' in July; the Foundation says it 'got the PHP project into' the programme; Calif says OpenAI invited them."
 },
 {
  "at": "2026-07-30",
  "event": "Calif begins an audit of PHP under Patch the Planet; Volker Dusch accepts the invitation.",
  "sources": [
   "php-foundation-blog-security-release",
   "calif-php2shell"
  ],
  "confidence": "stated",
  "phase": "discovery",
  "agent": "claude-story-site"
 },
 {
  "at": "2026-08-01",
  "event": "Calif discovers 'multiple different paths independently leading to RCE that resurfaced the 2024 issues and new trigger points'.",
  "sources": [
   "calif-php2shell"
  ],
  "confidence": "stated",
  "phase": "discovery",
  "agent": "claude-story-site"
 },
 {
  "at": "2026-08-05T15:54Z",
  "event": "Ryan Austin (@lcfr_hax) posts a SHA-256 hash on X as a commitment to one finding.",
  "sources": [
   "x-lcfr-hax-hash-tweet",
   "calif-php2shell"
  ],
  "confidence": "stated",
  "phase": "discovery",
  "agent": "claude-story-site",
  "note": "Time as displayed in a UTC browser. The pre-image has not been published."
 },
 {
  "at": "2026-08-11",
  "event": "Calif reports the first bug to PHP and coordinated disclosure begins. OpenAI independently reports the same root cause the same day.",
  "sources": [
   "calif-php2shell",
   "php-foundation-blog-security-release"
  ],
  "confidence": "stated",
  "phase": "coordination",
  "agent": "claude-story-site"
 },
 {
  "at": "2026-08-14",
  "event": "Calif shares an RCE proof of concept with PHP; PHP confirms it works on 15 August.",
  "sources": [
   "calif-php2shell"
  ],
  "confidence": "stated",
  "phase": "coordination",
  "agent": "claude-story-site"
 },
 {
  "at": "2026-08-19",
  "event": "Wiz Research discovers the first vulnerability using Wiz Atlas, Gemini 4 Argon and GPT-5.6 Sol; confirms RCE against Drupal on 20 August and WordPress on 21 August.",
  "sources": [
   "wiz-blog-php2shell"
  ],
  "confidence": "stated",
  "phase": "discovery",
  "agent": "claude-story-site"
 },
 {
  "at": "2026-08-21",
  "event": "Calif reports the second bug to PHP.",
  "sources": [
   "calif-php2shell"
  ],
  "confidence": "stated",
  "phase": "coordination",
  "agent": "claude-story-site"
 },
 {
  "at": "2026-08-24",
  "event": "Wiz reports to the PHP security team.",
  "sources": [
   "wiz-blog-php2shell",
   "php-foundation-blog-security-release"
  ],
  "confidence": "stated",
  "phase": "coordination",
  "agent": "claude-story-site"
 },
 {
  "at": "2026-08-27",
  "event": "The GitHub security advisory is opened, credited to lcfr-hax, sagitzadik-wiz, amyb-oai and tomash-areion.",
  "sources": [
   "daubois-blog-php2shell-rumors"
  ],
  "confidence": "stated",
  "phase": "coordination",
  "agent": "claude-story-site"
 },
 {
  "at": "2026-09-18",
  "event": "Further attack vectors reported by OpenAI.",
  "sources": [
   "php-foundation-blog-security-release"
  ],
  "confidence": "stated",
  "phase": "coordination",
  "agent": "claude-story-site"
 },
 {
  "at": "2026-09-21",
  "event": "PHP acknowledges Wiz's reports 'and begins developing a coordinated fix'.",
  "sources": [
   "wiz-blog-php2shell"
  ],
  "confidence": "stated",
  "phase": "coordination",
  "agent": "claude-story-site",
  "note": "Conflicts with the Foundation's account that the fix was the top priority from 11 August."
 },
 {
  "at": "2026-09-25",
  "event": "The fix pull request is opened.",
  "sources": [
   "daubois-blog-php2shell-rumors"
  ],
  "confidence": "stated",
  "phase": "coordination",
  "agent": "claude-story-site"
 },
 {
  "at": "2026-10",
  "event": "Cloudflare starts developing WAF protections 'since early October 2026'.",
  "sources": [
   "cloudflare-blog-php2shell-waf"
  ],
  "confidence": "stated",
  "phase": "coordination",
  "agent": "claude-story-site"
 },
 {
  "at": "2026-10-12T21:03:58Z",
  "event": "CVE-2026-109618 and CVE-2026-109619 are reserved.",
  "sources": [
   "cve-cve-2026-109618",
   "cve-cve-2026-109619"
  ],
  "confidence": "stated",
  "phase": "coordination",
  "agent": "claude-story-site"
 },
 {
  "at": "2026-10-17",
  "event": "An exploit attempt from an anonymisation-network IP hits an Amazon MadPot honeypot.",
  "sources": [
   "thehackernews-php2shell-4days"
  ],
  "confidence": "stated",
  "phase": "leak",
  "agent": "claude-story-site",
  "note": "As Amazon's CISO told The Hacker News; no primary Amazon post found."
 },
 {
  "at": "2026-10-18",
  "event": "The final fix commit is authored; the 7.4 backport branch's commit is dated 18:10:24Z.",
  "sources": [
   "daubois-blog-php2shell-rumors",
   "github-php-src-branch-7.4-backport"
  ],
  "confidence": "stated",
  "phase": "coordination",
  "agent": "claude-story-site"
 },
 {
  "at": "2026-10-19T14:00Z",
  "event": "Release commits for 8.5.12, 8.4.27, 8.3.36 and 8.2.35 are made under embargo (14:00 to 17:04 UTC).",
  "sources": [
   "github-php-src-tags",
   "github-php-src-tag-php-8.5.12"
  ],
  "confidence": "stated",
  "phase": "coordination",
  "agent": "claude-story-site"
 },
 {
  "at": "2026-10-20T15:00Z",
  "event": "The two CVE IDs begin circulating on forums and social media with a wrong release time and a wrong CVSS of 10.0. Per Daubois: an anonymous Hacker News post, then screenshots, a 'PHP2Shell tool' screenshot credited to Calif.io, a short exploitation video, and watchTowr posting both CVE numbers.",
  "sources": [
   "php-foundation-blog-security-release",
   "daubois-blog-php2shell-rumors"
  ],
  "confidence": "stated",
  "phase": "leak",
  "agent": "claude-story-site",
  "note": "'around 15:00 UTC' per the Foundation."
 },
 {
  "at": "2026-10-20T19:30Z",
  "event": "php.net publishes the pre-announcement: release moved to 21 October 14:00 UTC, two critical vulnerabilities, CVSS v4.0 9.2, 'we reserve the right to release earlier'.",
  "sources": [
   "php-foundation-blog-security-release",
   "openwall-oss-security-2026-10-20-34",
   "php-net-advisory"
  ],
  "confidence": "disputed",
  "phase": "leak",
  "agent": "claude-story-site",
  "note": "19:30 UTC per the Foundation; the php.net feed says 20:32 UTC; oss-security relayed it at 20:22:51 UTC."
 },
 {
  "at": "2026-10-20T20:00Z",
  "event": "Calif 'mistakenly published a video' showing its proof of concept against several targets; copies circulate after it is deleted.",
  "sources": [
   "php-foundation-blog-security-release",
   "phpfoundation-blog-security-release-leak"
  ],
  "confidence": "stated",
  "phase": "leak",
  "agent": "claude-story-site",
  "note": "'around 20:00 UTC'. Calif's page does not mention it."
 },
 {
  "at": "2026-10-20T20:22:51Z",
  "event": "Alan Coopersmith relays the php.net pre-announcement to oss-security.",
  "sources": [
   "openwall-oss-security-2026-10-20-34"
  ],
  "confidence": "stated",
  "phase": "leak",
  "agent": "claude-story-site"
 },
 {
  "at": "2026-10-20",
  "event": "Swiss BACS posts a warning (home-page teaser dated 20 October; the page itself now says 21 October).",
  "sources": [
   "ch-ncsc-home",
   "ch-bacs-warnung-php"
  ],
  "confidence": "inferred",
  "phase": "response",
  "agent": "claude-story-site"
 },
 {
  "at": "2026-10-20T23:00Z",
  "event": "The PHP project starts giving mitigation advice to a few critical-infrastructure providers; it 'may have leaked as well'.",
  "sources": [
   "php-foundation-blog-security-release"
  ],
  "confidence": "stated",
  "phase": "leak",
  "agent": "claude-story-site"
 },
 {
  "at": "2026-10-21T02:00Z",
  "event": "Amazon sees proof-of-concept attempts, then six hours of attempts from anonymised infrastructure.",
  "sources": [
   "thehackernews-php2shell-4days"
  ],
  "confidence": "stated",
  "phase": "leak",
  "agent": "claude-story-site"
 },
 {
  "at": "2026-10-21T03:02Z",
  "event": "Cloudflare's WAF protections go live for all customers, about nine hours ahead of disclosure.",
  "sources": [
   "cloudflare-blog-php2shell-waf"
  ],
  "confidence": "stated",
  "phase": "response",
  "agent": "claude-story-site"
 },
 {
  "at": "2026-10-21T07:41Z",
  "event": "Chainguard publishes built images containing the fix, 'more than six hours before the coordinated release'.",
  "sources": [
   "php-foundation-blog-security-release",
   "techzine-php-chainguard"
  ],
  "confidence": "stated",
  "phase": "leak",
  "agent": "claude-story-site",
  "note": "Chainguard reportedly denies leaking; that article is blocked."
 },
 {
  "at": "2026-10-21T08:36Z",
  "event": "ELLIO records its first sensor hit.",
  "sources": [
   "thehackernews-php2shell-4days",
   "phpfoundation-blog-security-release-leak"
  ],
  "confidence": "stated",
  "phase": "leak",
  "agent": "claude-story-site"
 },
 {
  "at": "2026-10-21T13:30Z",
  "event": "CERT-EU's stated release time for the PHP fixes.",
  "sources": [
   "certeu-sa-2026-018"
  ],
  "confidence": "stated",
  "phase": "release",
  "agent": "claude-story-site",
  "note": "Differs from the planned 14:00 UTC and from the 13:35 UTC tags."
 },
 {
  "at": "2026-10-21T13:32Z",